{
  "disassemblyStatus" : "assembled",
  "sparePartQuality" : "A",
  "healthStatus" : "in running condition",
  "certificateOfDestruction" : true,
  "dateOfReceptionGMT" : "2021-09-30",
  "lastMileage" : -1.7976931348623157E308,
  "dateOfDissamblyGMT" : "2021-09-30",
  "dateOfScrappingGMT" : "2021-09-30",
  "recyclingStatus" : "recycled"
}